<?xml version="1.0" ?>
	<!DOCTYPE student SYSTEM "q-6.dtd" >
	<student>
		<name>
			<fname>maharshi</fname>
			<lname>patel</lname>
		</name>
		<id>69</id>
		<plan>
			<course year="2023">
				<coursename>Intergreted Masters in Science Of INformation Technology</coursename>
				<shortname>iMscIT</shortname>
				<record >
					<grade>O+</grade>
					<date>20/07/2024</date>
				</record>
			</course>
		</plan>
	</student>